<?xml version='1.0' encoding='UTF-8'?>
<DataTrade xmlns:xsi="http://www.w3.org/2001/XMLSchema-instance" xsi:schemaLocation="http://www.kpei.co.id/DataTradeRequest file:/C:/jdeveloper-doc/OR08-DataFeedTrade/xsd/DataTrade-request.xsd" xmlns="http://www.kpei.co.id/DataTradeRequest">
   <header id="id1">
      <asAt>2011-01-17T19:52:56.359</asAt>
      <source>source2</source>
   </header>
   <body>
      <trade>
         <tradeNumber>tradeNumber3</tradeNumber>
         <sellerBuyer>
            <sellerBroker/>
            <stockCode/>
            <boardCode/>
            <tradeNumber/>
            <tradeDate/>
            <buyerBroker/>
         </sellerBuyer>
         <tradeDate>2011-01-17</tradeDate>
         <sessionTrade>sessionTrade4</sessionTrade>
         <boardCode>boardCode5</boardCode>
         <sellerBroker>sellerBroker6</sellerBroker>
         <sellerClient>sellerClient7</sellerClient>
         <sellerType>sellerType8</sellerType>
         <brokerCode>brokerCode9</brokerCode>
         <brokerClient>brokerClient10</brokerClient>
         <brokerType>brokerType11</brokerType>
         <stockCode>stockCode12</stockCode>
         <volume>volume13</volume>
         <price>price14</price>
      </trade>
   </body>
   <ext>
      <value id="id15">string16</value>
      <value id="id17">string18</value>
      <value id="id19">string20</value>
   </ext>
</DataTrade>
